Clutch Slave Cylinder For HONDA CIVIC, Clutch Slave Cylinder For HONDA CIVIC MK8 2.2 CTDI 2005-2011| CRV 2.2 CTDI 2007, 62.50, 7, Spare part, Civic
AUTOMATIC 8 SPEED GEARBOX, BMW F07 F02 F01 F11 630d 730d 530d N57 8HP70 8HP70Z AUTOMATIC 8 SPEED GEARBOX, 1500.00, 3, Spare part,
Oil Filter For Toyota GT86, Genuine Oil Filter For Toyota GT86 4UGSE 2012 Onwards 90915YZZS2, 10.49, 32, Spare part, GT86
Land Rover Freelander 2 Rubber Floor Boot Liner, Genuine Land Rover Freelander 2 Rubber Floor Boot Liner Mat Liner 2007 - 2014, 75.00, 14, Accessory, Freelander
Milwaukee Impact Driver, Milwaukee 3453-20 M12 Fuel 1/4 Hex Impact Driver 12 Volt GEN 3, 72.99, 14, Tool,
Front Suspension Strut and Coil Spring Assembly for Nissan Sentra, 2 Front Suspension Strut and Coil Spring Assembly FCS fits 2013 Nissan Sentra, 225.00, 5, Spare part, Sentra
Screwdriver Set With Case, 58 in 1 Magnetic Screwdriver Set Slotted Phillips Torx Pozidriv Hex With Case, 30.00, 9, Tool,
Front & Rear Rotors & Brake Pads for Chevy Silverado, 12" Front & 12.78" Rear Drilled Rotors Brake Pads for Chevy Silverado, 243.47, 6, Spare part, Silverado, True, 192.34
Audi A1 Front & Rear Brake Discs & Pads, Audi A1 1.4 TFSi 120/125/140/150bhp 1.6 TDi 10- Front & Rear Brake Discs & Pads, 174.99, 6, Spare part, A1
Front Braided Brake Line for Audi A3, StopTech 950.33026 Front Braided Brake Line for 15-19 Audi A3 S3, 107.23, 12, Spare part, A3, True, 96.51
Audi A8 S8 Q7 Cigarette Lighter Cover, Audi A8 S8 Q7 quattro 2010-2017 Car Cigarette Lighter Cover Black, 10.02, 21, Accessory, True, 8.99
BIG RED 3 Ton Steel Jack Stands, BIG RED 3 Ton (6.000 lb) T43202 Torin Steel Jack Stands Capacity Red, 32.99, 9, Tool,
Craftsman SAE Wrench Set, Craftsman SAE Full Polish Combination Ratcheting Wrench Set - 10 pcs, 69.97, 31, Tool,
Chevrolet Performance 19433030 Crate Engine, Chevrolet Performance 19433030 Crate Engine - Sbc 350/330Hp Crate Engine 350 Cu, 6578.80, 1, Spare part, True, 5999.99
MSD 84741 Crate Engine Ignition Kit, MSD 84741 Crate Engine Ignition Kit For GM NEW, 686.95, 5, Spare part,
Headlight Right Passenger Side For Dodge Challenger, Headlight Headlamp Right Passenger Side For Dodge Challenger 2015 2016-2020 2021, 178.96, 4, Spare part, Challenger, True, 116.32
Dodge Challenger Scat Pack LED Door Courtesy Puddle Lights, Dodge Challenger Scat Pack LED Door Courtesy Puddle Lights 6.4L R/T 392 SRT, 59.99, 8, Accessory, Challenger, True, 53.99
SpeedFactory Racing Fuel Cell, SpeedFactory Racing Front Mount Drag Race Fuel Cell With Mounting Tabs, 388.54, 3, Spare part,
Eventuri Complete Black Carbon Inlet Plenum for BMW M3, Eventuri Complete Black Carbon Inlet Plenum for BMW E9X M3, 2435.00, 2, Spare part, 3 Series
Air Filters for Audi R8, K&N E-0668 Drop in Air Filters for Replacement for 08-13 Audi R8 4.2L V8, 329.99, 4, Spare part, R8
3 Tier Rolling Tool Cart, 3 Tier Rolling Tool Cart 880LBS Capacity Heavy Duty Utility Cart Tool Organizer, 124.19, 2, Tool,
FERRARI PORTOFINO PASSENGER SIDE HEADLIGHT, 2018 2019 2020 2021 FERRARI PORTOFINO F164 RIGHT PASSENGER SIDE HEADLIGHT LED, 649.99, 3, Spare part, Portofino
Ferrari 458 Challenge Complete Engine, Ferrari 458 Challenge Complete Engine (277603) - USED, 3400000, 1, Spare part, 458
